<?xml version="1.0" encoding="UTF-8"?>
<ontologyconfiguration xmlns:xsi="http://www.w3.org/2001/XMLSchema-instance" 
 xsi:noNamespaceSchemaLocation="ontology-configuration.xsd">
	<ontology name="GeneOntology">
		<source>http://www.geneontology.org/ontology/obo_format_1_2/gene_ontology_ext.obo
		</source>
		<roots>
			<root>GO:0008150</root>
			<root>GO:0003674</root>
			<root>GO:0005575</root>
		</roots>
	</ontology>
	<ontology name="PATO" longName="Phenotypic Quality Ontology">
		<source>http://pato.googlecode.com/svn/trunk/quality.obo</source>
		<roots>
			<root>PATO:0000001</root>
		</roots>
	</ontology>
	<ontology name="OMP" longName="Mammalian Phenotype Ontology">
		<source>http://obo.cvs.sourceforge.net/*checkout*/obo/obo/ontology/phenotype/mammalian_phenotype.obo</source>
		<roots>
			<root>MP:0000001</root>
		</roots>
	</ontology>
</ontologyconfiguration>