<?xml version="1.0" encoding="UTF-8"?>
<ontologyconfiguration xmlns:xsi="http://www.w3.org/2001/XMLSchema-instance" 
 xsi:noNamespaceSchemaLocation="ontology-configuration.xsd">
	<ontology name="GeneOntology">
		<source>http://www.geneontology.org/ontology/editors/gene_ontology_write.obo</source>
		<supports>
			<support>http://www.geneontology.org/ontology/editors/gene_ontology_xp_write.obo</support>
			<support>http://purl.obolibrary.org/obo/go/extensions/x-disjoint.owl</support>
		</supports>
		<roots>
			<root>GO:0008150</root>
			<root>GO:0003674</root>
			<root>GO:0005575</root>
		</roots>
	</ontology>
</ontologyconfiguration>