<?xml version="1.0" encoding="UTF-8"?>
<ontologyconfiguration xmlns:xsi="http://www.w3.org/2001/XMLSchema-instance" 
 xsi:noNamespaceSchemaLocation="ontology-configuration.xsd">
	<ontology name="GeneOntology">
		<source>http://www.geneontology.org/ontology/editors/gene_ontology_write.obo
		</source>
		<roots>
			<root>GO:0008150</root>
			<root>GO:0003674</root>
			<root>GO:0005575</root>
		</roots>
		<ontologybranch name="biological_process">
			<roots>
				<root>GO:0008150</root>
			</roots>
		</ontologybranch>
	</ontology>
</ontologyconfiguration>