<?xml version="1.0" encoding="UTF-8"?>
<ontologyconfiguration xmlns:xsi="http://www.w3.org/2001/XMLSchema-instance" 
 xsi:noNamespaceSchemaLocation="ontology-configuration.xsd">
	<ontology name="OBA">
		<source>http://purl.obolibrary.org/obo/go/extensions/bio-attributes.obo</source>
		<supports>
			<support>http://purl.obolibrary.org/obo/go/extensions/x-attribute.obo</support>
		</supports>
		<roots>
			<root>OBA:0000001</root>
			<root>UBERON:0001062</root> <!-- anatomical entity -->
			<root>CL:0000003</root> <!-- native cell -->
			<root>GO:0005575</root> <!-- cellular component -->
			<root>PATO:0000001</root> <!-- quality -->
			<root>PO:0025131</root> <!-- plant anatomical entity -->
		</roots>
		<ontologybranch name="entity">
			<!-- Entity: any term from uberon, CL or GO-CC -->
			<roots>
				<root>UBERON:0001062</root> <!-- anatomical entity -->
				<root>CL:0000003</root> <!-- native cell -->
				<root>GO:0005575</root> <!-- cellular component -->
				<root>PO:0025131</root> <!-- plant anatomical entity -->
			</roots>
		</ontologybranch>
		<ontologybranch name="quality">
			<roots>
				<root>PATO:0000001</root> <!-- quality -->
			</roots>
		</ontologybranch>
		<ontologybranch name="default_oba">
			<roots>
				<root>OBA:0000001</root>
			</roots>
		</ontologybranch>
	</ontology>
</ontologyconfiguration>